{"schema_version":2,"binding_id":"binding-1","repository_id":"repo-1","worktree_id":"worktree-1","worktree_sha256":"aaaaaaaaaaaaaaaaaaaaaaaaaaaaaaaaaaaaaaaaaaaaaaaaaaaaaaaaaaaaaaaa","base_revision":"bbbbbbbbbbbbbbbbbbbbbbbbbbbbbbbbbbbbbbbbbbbbbbbbbbbbbbbbbbbbbbbb","head_revision":"cccccccccccccccccccccccccccccccccccccccccccccccccccccccccccccccc","merge_base_revision":"bbbbbbbbbbbbbbbbbbbbbbbbbbbbbbbbbbbbbbbbbbbbbbbbbbbbbbbbbbbbbbbb","fork_repository_id":null,"changed_paths_sha256":"dddddddddddddddddddddddddddddddddddddddddddddddddddddddddddddddd","dependency_state_sha256":"eeeeeeeeeeeeeeeeeeeeeeeeeeeeeeeeeeeeeeeeeeeeeeeeeeeeeeeeeeeeeeee","instruction_state_sha256":"ffffffffffffffffffffffffffffffffffffffffffffffffffffffffffffffff","test_state_sha256":"1111111111111111111111111111111111111111111111111111111111111111","commits_since_review":1,"base_moved":false,"active_checkout_unchanged":true,"remote_state_unchanged":true}
